{
  "run_recorded": {
    "commands": [
      {
        "command": [
          "python3",
          "paper/tools/check_archive_reproduction.py"
        ],
        "cwd": ".",
        "environment": {},
        "exit_code": 0,
        "id": "archive_reproduction",
        "kind": "check",
        "log_path": "lean/.validate-logs/W24-archive-refresh/archive-console.log",
        "log_sha256": "2ddb4cec9c943ab71fd71748f619285c2c1604d208acdd02173cc5641678506c",
        "metrics": {},
        "metrics_note": "",
        "metrics_status": "valid",
        "recorded_at": "2026-10-14T13:22:49+00:00",
        "status": "pass",
        "summary": "{\"id\": \"package\", \"command\": [\"python3\", \"paper/prewriting/validate_package.py\"], \"cwd\": \".\", \"exit_code\": 0, \"expected_exit\": 0, \"status\": \"pass\", \"log_path\": \"/tmp/W19b-archive-jo79ofwk/logs/package.log\", \"log_sha256\": \"c9c698f276f14109c8e9a1deeb157bfd0a00b457fa6c3ff7cfd75a5f935337ec\"}\n{\"id\": \"snapshot\", \"command\": [\"python3\", \"paper/tools/export_results.py\", \"--check\"], \"cwd\": \".\", \"exit_code\": 0, \"expected_exit\": 0, \"status\": \"pass\", \"log_path\": \"/tmp/W19b-archive-jo79ofwk/logs/snapshot.log\", \"log_sha256\": \"5fe084344c0e4d06c5eaf2933bc96c310aee8e2dbcdac6c88eb055e7028c0c3c\"}\nRUN paper_tests: python3 -m pytest -q paper/tests (cwd .)\n{\"id\": \"paper_tests\", \"command\": [\"python3\", \"-m\", \"pytest\", \"-q\", \"paper/tests\"], \"cwd\": \".\", \"exit_code\": 0, \"expected_exit\": 0, \"status\": \"pass\", \"log_path\": \"/tmp/W19b-archive-jo79ofwk/logs/paper_tests.log\", \"log_sha256\": \"7fbe84fe23e7f5a60cb11ebe880ee3a6a5a7f8942f566ffb317de462c00a8553\"}\n{\"archive_reproduction\": \"pass\", \"report\": \"/tmp/W19b-archive-jo79ofwk/report.json\"}"
      },
      {
        "command": [
          "python3",
          "scripts/check_corridor_transcription.py"
        ],
        "cwd": ".",
        "environment": {},
        "exit_code": 0,
        "id": "check_corridor_transcription",
        "kind": "check",
        "log_path": "lean/.validate-logs/W19a/check_corridor_transcription.log",
        "log_sha256": "ce59e3b339c3b2de4d8e99f0eeff1399b65bf719701dbcdea38c54bd98500908",
        "metrics": {},
        "recorded_at": "2026-10-13T11:33:59+00:00",
        "status": "pass",
        "summary": "PASS: Lean-evaluated stages (all eight frontier fields, support, realization), events/owners/ordinals, dependencies, carrier chain, additive inputs and computed removal projections, audit references, derived updates; constructed COMPOSED stages/event graph/leg descriptors.\nNon-evidence: stored transport booleans and route-status labels; descriptive labels/metadata are not operative inputs.\nCOR-POS-02A sha256 6a162e3005a78178e4790efe381ebd848b733b388f6c0207081b8cd221b96aa8\nCOR-POS-02B sha256 165c98510f8ea091b2e8149fa4f02f8e8c3be892337fb4619846712ff3977e4d\nCOR-POS-02-COMPOSED sha256 4ca7c0047b05bc42c8acfa1b4f4f064b86ac125a49b46e9a6acd46835811fe88"
      },
      {
        "command": [
          "python3",
          "scripts/check_full_native_02_autonomy_transcription.py"
        ],
        "cwd": ".",
        "environment": {},
        "exit_code": 0,
        "id": "check_full_native_02_autonomy_transcription",
        "kind": "check",
        "log_path": "lean/.validate-logs/W19a/check_full_native_02_autonomy_transcription.log",
        "log_sha256": "50a984c5c5b6040650f644ff79a71f59eda127c3f6e0481fc3021b4d8640b5ae",
        "metrics": {},
        "recorded_at": "2026-10-13T11:34:07+00:00",
        "status": "pass",
        "summary": "G31b transcription passed: 11 credited endpoints; 88 maintenance, 11 probe and 88 absent successors;\nSelector permutation regression passed: both three-key acquisitions + all16 positive maintenance successors.\n9 interleaved foreign responses; 8 cold + 64 stronger-fork newborns; 256 ROM/supply/charge factors; frozen pins unchanged."
      },
      {
        "command": [
          "python3",
          "scripts/check_full_native_02_fusion_transcription.py"
        ],
        "cwd": ".",
        "environment": {},
        "exit_code": 0,
        "id": "check_full_native_02_fusion_transcription",
        "kind": "check",
        "log_path": "lean/.validate-logs/W19a/check_full_native_02_fusion_transcription.log",
        "log_sha256": "b26186ab8a61568f1a7da5f6fa72b546fdf5169bd133df76c80665e7c621f483",
        "metrics": {},
        "recorded_at": "2026-10-13T11:34:09+00:00",
        "status": "pass",
        "summary": "G31a transcription passed: 128 ROM/action rows, 8 complete worlds, all 8 fusion + 8 refusion outputs,\n2 unchanged-world empty diagnostics, 8 initially stored absent steps, 13 rejection controls; 48 frozen source pins match.\nAll 8 outputs complete the frozen own 7-step warmup; all 64 subsequent stronger-fork fusion worlds match."
      },
      {
        "command": [
          "python3",
          "scripts/check_full_native_binding_transcription.py"
        ],
        "cwd": ".",
        "environment": {},
        "exit_code": 0,
        "id": "check_full_native_binding_transcription",
        "kind": "check",
        "log_path": "lean/.validate-logs/W19a/check_full_native_binding_transcription.log",
        "log_sha256": "ea15883fd8efc77a307b02e39e6f944d1ac524aca4cf8197ee507799b3909ce1",
        "metrics": {},
        "recorded_at": "2026-10-13T11:34:11+00:00",
        "status": "pass",
        "summary": "PASS: six actually supported source/target split executions, installed flattening control, complete rooted contexts\nPASS: caught planted drift: prepend initial observation\nPASS: caught planted drift: retain native correlations after flattening\nPASS: caught planted drift: inherit source hardware owner\nPASS: caught planted drift: discard consumed snapshot receipt"
      },
      {
        "command": [
          "python3",
          "scripts/check_full_native_countermodels_transcription.py"
        ],
        "cwd": ".",
        "environment": {},
        "exit_code": 0,
        "id": "check_full_native_countermodels_transcription",
        "kind": "check",
        "log_path": "lean/.validate-logs/W19a/check_full_native_countermodels_transcription.log",
        "log_sha256": "ac4d91a8e2512be3e62048e9a59c015fcb801b780fc5d369bac68979abb84205",
        "metrics": {},
        "recorded_at": "2026-10-13T11:34:14+00:00",
        "status": "pass",
        "summary": "G28 transcription passed: target checkpoint/prefix, registered flat control, 115 ordered law queries,\n16 original cycle edges; CURRENT aliases but 2 full-decoder boundaries fail; C6 positions 1 versus 0."
      },
      {
        "command": [
          "python3",
          "scripts/check_full_native_credit_transcription.py"
        ],
        "cwd": ".",
        "environment": {},
        "exit_code": 0,
        "id": "check_full_native_credit_transcription",
        "kind": "check",
        "log_path": "lean/.validate-logs/W19a/check_full_native_credit_transcription.log",
        "log_sha256": "363dca2c47aa9d96ec235ce718b311769b6276e9338bdfd4e64dff5af8153fdc",
        "metrics": {},
        "recorded_at": "2026-10-13T11:34:15+00:00",
        "status": "pass",
        "summary": "PASS: caught planted drift: housing credited as issuer\nPASS: caught planted drift: mixed issuer accepted\nPASS: caught planted drift: source issuer inherited by target\nPASS: caught planted drift: copied receipt replaced by fresh default\nPASS: caught planted drift: absence erases initial stored charge"
      },
      {
        "command": [
          "python3",
          "scripts/check_full_native_execution_transcription.py"
        ],
        "cwd": ".",
        "environment": {},
        "exit_code": 0,
        "id": "check_full_native_execution_transcription",
        "kind": "check",
        "log_path": "lean/.validate-logs/W19a/check_full_native_execution_transcription.log",
        "log_sha256": "0975486d90ab0de36dc183429da8b6ab2b2ebd14cb8c274664b403da556c621a",
        "metrics": {},
        "recorded_at": "2026-10-13T11:34:17+00:00",
        "status": "pass",
        "summary": "PASS execution transcription: 24 account/input contexts, 1536 action rows, 576 enabled edges\nCAUGHT planted recharge drift\nCAUGHT planted port consumption drift\nCAUGHT planted receipt source drift"
      },
      {
        "command": [
          "python3",
          "scripts/check_full_native_iaps_transcription.py"
        ],
        "cwd": ".",
        "environment": {},
        "exit_code": 0,
        "id": "check_full_native_iaps_transcription",
        "kind": "check",
        "log_path": "lean/.validate-logs/W19a/check_full_native_iaps_transcription.log",
        "log_sha256": "0652d27808a2a19a19bd3d3bd690c1452db6bafd76177318e0ed64e0460f17e1",
        "metrics": {},
        "recorded_at": "2026-10-13T11:34:19+00:00",
        "status": "pass",
        "summary": "G29 transcription passed: 3 endpoints, 4 decoded edges, 18 rejected successors,\n81 paired outcomes; withdrawn source remains absent, both parents retain distinct ownership; missing edges reject."
      },
      {
        "command": [
          "python3",
          "scripts/check_full_native_objecthood_transcription.py"
        ],
        "cwd": ".",
        "environment": {},
        "exit_code": 0,
        "id": "check_full_native_objecthood_transcription",
        "kind": "check",
        "log_path": "lean/.validate-logs/W19a/check_full_native_objecthood_transcription.log",
        "log_sha256": "9bf70ca43b122b5a2b44a79fdb032bbd6265011b927d1419acebeb77e97cde38",
        "metrics": {},
        "recorded_at": "2026-10-13T11:34:21+00:00",
        "status": "pass",
        "summary": "PASS full32 C1: derived prototypes/classes/C/U/CU, all4 closure and squared matrices, stationary laws, retention/TV/defects, phase counterexample\nCAUGHT planted clock phase drift\nCAUGHT planted perturb-before-power drift\nCAUGHT planted stationary mass drift"
      },
      {
        "command": [